{
  "$schema": "./metadata.schema.json",
  "schema_version": 2,
  "metadata_revision": "2026-08-29",
  "product": {
    "id": "nimbo",
    "release": "1.1.0",
    "urls": {
      "marketing": "https://nimbo.uz/",
      "support": "https://nimbo.uz/support/",
      "privacy": "https://nimbo.uz/privacy/"
    }
  },
  "localizations": {
    "en-US": {
      "title": "Nimbo",
      "subtitle": "Local forecast, made familiar",
      "short_description": "Understand the hours ahead through weather you have recently felt.",
      "keywords": "weather,forecast,ob havo,Toshkent ob-havo,prognoz,hourly,offline,temperature,rain,wind,local",
      "description": "Weather is easier to understand when it feels familiar.\n\nSee your local weather forecast now, hour by hour, and for the next 10 days. Nimbo shows current conditions and the next 24 hours alongside recent weather from the same place, so you can tell whether the hours ahead will feel warmer, cooler, wetter, or much the same as yesterday.\n\n• A clear current-weather summary\n• A chronological −24 / NOW / +24 timeline\n• Comparisons with yesterday and recent days\n• Best Time Outside based on comfort and weather hazards\n• A 10-day forecast and air quality\n• Cached weather when your connection is unavailable\n• Home-screen widgets and companion apps for Apple Watch and Wear OS\n• Automatic, metric, or imperial units\n\nNo account, ads, or analytics. Approximate location is optional; city search works without location permission.\n\nWeather and place data are provided by Open-Meteo. Historical values are model and reanalysis data, not verified station observations.",
      "release_notes": "Widgets and companion apps for Apple Watch and Wear OS make Nimbo glanceable. Also includes a 10-day forecast, air quality, automatic refresh, sharing, saved places, offline cache, and 13 languages."
    },
    "ru-RU": {
      "title": "Nimbo",
      "subtitle": "Понятный прогноз погоды",
      "short_description": "Поймите погоду на ближайшие часы через знакомые недавние ощущения.",
      "keywords": "погода,прогноз,ob havo,Toshkent ob-havo,weather,prognoz,почасовой",
      "description": "Местный прогноз погоды для Ташкента и других городов Узбекистана: узнайте удобное время для выхода на улицу.\n\nNimbo показывает текущие условия, ближайшие 24 часа и прогноз на 10 дней рядом с недавней погодой в том же месте. Сразу видно, будут ли следующие часы теплее, прохладнее, дождливее или примерно такими же, как вчера.\n\n• Понятная сводка о погоде сейчас\n• Хронологическая шкала −24 / СЕЙЧАС / +24\n• Сравнение со вчерашним днём и недавними днями\n• Лучшее время для прогулки с учётом комфорта и опасных условий\n• Поиск Ташкента, Самарканда, Бухары и других городов без разрешения геолокации\n• Прогноз на 10 дней и качество воздуха\n• Сохранённая погода без подключения к сети\n• Виджеты и приложения-компаньоны для Apple Watch и Wear OS\n• Автоматические, метрические или имперские единицы\n\nБез аккаунта, рекламы и аналитики. Приблизительное местоположение необязательно: город можно найти без разрешения геолокации.\n\nДанные о погоде и местах предоставляет Open-Meteo. Исторические значения основаны на моделях и реанализе, а не на подтверждённых наблюдениях конкретной метеостанции.",
      "release_notes": "Виджеты и приложения для Apple Watch и Wear OS показывают Nimbo с первого взгляда. Также добавлены прогноз на 10 дней, качество воздуха, автообновление, отправка погоды, сохранённые места, офлайн-кэш и 13 языков."
    },
    "ar": {
      "title": "Nimbo",
      "subtitle": "طقس يسهل فهمه",
      "short_description": "افهم الساعات القادمة بمقارنتها بطقس شعرت به مؤخرًا.",
      "keywords": "طقس,توقعات,كل ساعة,دون اتصال,حرارة,مطر,رياح",
      "description": "يسهل فهم الطقس عندما تقارنه بشيء مألوف.\n\nيعرض Nimbo الطقس الحالي والساعات الـ24 القادمة بجانب طقس الأيام الأخيرة في المكان نفسه، لتعرف بسرعة إن كانت الساعات القادمة أدفأ أو أبرد أو أكثر مطرًا أو شبيهة بالأمس.\n\n• ملخص واضح للطقس الآن\n• خط زمني مرتب: −24 / الآن / +24\n• مقارنة مع الأمس والأيام الأخيرة\n• أفضل وقت للخروج وفق الراحة ومخاطر الطقس\n• طقس محفوظ عند انقطاع الاتصال\n• أدوات وتطبيقات مصاحبة لـ Apple Watch وWear OS\n• وحدات تلقائية أو مترية أو إمبراطورية\n\nلا حسابات ولا إعلانات ولا تحليلات. الموقع التقريبي اختياري، ويمكن البحث عن مدينة دون إذن الموقع.\n\nيوفر Open-Meteo بيانات الطقس والأماكن. القيم التاريخية ناتجة عن نماذج وإعادة تحليل، وليست رصدًا موثقًا من محطة بعينها.",
      "release_notes": "تعرّف على Nimbo: افهم الساعات الـ24 القادمة بمقارنتها بطقس شعرت به مؤخرًا، مع التخزين دون اتصال وسياق الأيام الأخيرة وأفضل وقت للخروج ودعم 13 لغة."
    },
    "es-ES": {
      "title": "Nimbo",
      "subtitle": "El tiempo, más familiar",
      "short_description": "Entiende las próximas horas comparándolas con el tiempo reciente.",
      "keywords": "tiempo,pronóstico,horas,sin conexión,temperatura,lluvia,viento",
      "description": "El tiempo se entiende mejor cuando resulta familiar.\n\nNimbo muestra las condiciones actuales y las próximas 24 horas junto al tiempo reciente del mismo lugar. Descubre si las horas que vienen se sentirán más cálidas, frescas, lluviosas o parecidas a ayer.\n\n• Resumen claro del tiempo actual\n• Línea temporal cronológica −24 / AHORA / +24\n• Comparaciones con ayer y los últimos días\n• Mejor momento para salir según el confort y los riesgos\n• Tiempo guardado cuando no hay conexión\n• Widgets y apps complementarias para Apple Watch y Wear OS\n• Unidades automáticas, métricas o imperiales\n\nSin cuenta, anuncios ni analítica. La ubicación aproximada es opcional y puedes buscar una ciudad sin permiso de ubicación.\n\nOpen-Meteo proporciona los datos meteorológicos y de lugares. Los valores históricos proceden de modelos y reanálisis, no de observaciones verificadas de una estación concreta.",
      "release_notes": "Descubre Nimbo: entiende las próximas 24 horas comparándolas con el tiempo que has sentido recientemente. Incluye caché sin conexión, contexto reciente, mejor momento para salir y 13 idiomas."
    },
    "fr-FR": {
      "title": "Nimbo",
      "subtitle": "Une météo plus familière",
      "short_description": "Comprenez les prochaines heures grâce à la météo ressentie récemment.",
      "keywords": "météo,prévisions,heure,hors ligne,température,pluie,vent",
      "description": "La météo est plus simple à comprendre lorsqu’elle semble familière.\n\nNimbo présente les conditions actuelles et les prochaines 24 heures avec la météo récente du même lieu. Voyez si les heures à venir seront plus chaudes, plus fraîches, plus humides ou proches d’hier.\n\n• Un résumé clair de la météo actuelle\n• Une chronologie −24 / MAINTENANT / +24\n• Des comparaisons avec hier et les derniers jours\n• Le meilleur moment pour sortir selon le confort et les risques\n• La météo enregistrée en cas de coupure réseau\n• Des widgets et apps compagnons pour Apple Watch et Wear OS\n• Des unités automatiques, métriques ou impériales\n\nSans compte, publicité ni analyse d’usage. La position approximative est facultative et la recherche de ville fonctionne sans autorisation.\n\nOpen-Meteo fournit les données météo et de lieux. Les valeurs historiques proviennent de modèles et de réanalyses, et non d’observations vérifiées d’une station précise.",
      "release_notes": "Découvrez Nimbo : comprenez les prochaines 24 heures en les comparant à la météo ressentie récemment. Avec cache hors ligne, contexte récent, meilleur moment pour sortir et 13 langues."
    },
    "de-DE": {
      "title": "Nimbo",
      "subtitle": "Wetter, das vertraut wirkt",
      "short_description": "Verstehe die nächsten Stunden im Vergleich zum Wetter der letzten Tage.",
      "keywords": "Wetter,Vorhersage,stündlich,offline,Temperatur,Regen,Wind",
      "description": "Wetter ist leichter zu verstehen, wenn es sich vertraut anfühlt.\n\nNimbo zeigt die aktuellen Bedingungen und die nächsten 24 Stunden zusammen mit dem Wetter der letzten Tage am selben Ort. So erkennst du, ob es wärmer, kühler, nasser oder ähnlich wie gestern wird.\n\n• Klare Zusammenfassung des aktuellen Wetters\n• Chronologische Zeitleiste −24 / JETZT / +24\n• Vergleiche mit gestern und den letzten Tagen\n• Beste Zeit im Freien nach Komfort und Wettergefahren\n• Gespeichertes Wetter ohne Netzverbindung\n• Widgets und Begleit-Apps für Apple Watch und Wear OS\n• Automatische, metrische oder imperiale Einheiten\n\nOhne Konto, Werbung oder Analysen. Der ungefähre Standort ist optional; die Städtesuche funktioniert ohne Standortberechtigung.\n\nOpen-Meteo liefert Wetter- und Ortsdaten. Historische Werte stammen aus Modellen und Reanalysen, nicht aus bestätigten Messungen einer bestimmten Wetterstation.",
      "release_notes": "Nimbo ist da: Verstehe die nächsten 24 Stunden durch den Vergleich mit kürzlich erlebtem Wetter. Mit Offline-Cache, Tagesvergleichen, bester Zeit im Freien und 13 Sprachen."
    },
    "pt-PT": {
      "title": "Nimbo",
      "subtitle": "Tempo fácil de entender",
      "short_description": "Perceba as próximas horas comparando-as com o tempo recente.",
      "keywords": "tempo,previsão,hora,offline,temperatura,chuva,vento",